ID;OID;TYPE;NAME;LEVEL;PATIENT_INFO;SHELF_LIFE;STORAGE_TYPE;EXTENDED_LIFE;UNLIMITED_LIFE;MO_SIGN;FORMAT;START_DATE;END_DATE;IMPLEMENTATION_GUIDE;GIT_LINK;SHOW_PATIENT;IS_ONLINE;DAYS_COUNT;SERIES_REQUIRED
62;62;86;"Рецепт на лекарственный препарат (CDA) Редакция 1";3;"Обязательны с указанием СНИЛС";"25 лет";"Выдается МО";"Да";"Да";"Да";2;"15.03.2021";"01.07.2025";"https://portal.egisz.rosminzdrav.ru/materials/3823";"1.2.643.5.1.13.13.15.3.1";"Да";"Нет";;"Нет"
80;80;88;"Справка об отсутствии контактов с инфекционными больными (CDA) Редакция 2";3;"Обязательны с указанием СНИЛС";"25 лет";"Выдается МО";"Да";"Да";"Да";2;"30.06.2021";"01.07.2025";"https://portal.egisz.rosminzdrav.ru/materials/3909";"1.2.643.5.1.13.13.15.56.2";"Да";"Нет";;"Нет"
83;83;71;"Медицинское заключение об отсутствии противопоказаний к занятию определенными видами спорта (CDA) Редакция 2";3;"Обязательны с указанием СНИЛС";"25 лет";"Выдается МО";"Да";"Да";"Да";2;"30.06.2021";"01.07.2025";"https://portal.egisz.rosminzdrav.ru/materials/3911";"1.2.643.5.1.13.13.15.54.2";"Да";"Нет";;"Нет"
43;43;3;"Направление на госпитализацию, восстановительное лечение, обследование, консультацию (CDA) Редакция 2";3;"Обязательны с указанием СНИЛС";"25 лет";"Хранится в МО";"Да";"Да";"Да";2;"14.09.2020";"01.07.2025";"https://portal.egisz.rosminzdrav.ru/materials/2933";"1.2.643.5.1.13.13.15.31.2";"Да";"Нет";;"Нет"
146;146;106;"Талон № 2 на получение специальных талонов (именных направлений) на проезд к месту лечения для получения медицинской помощи (CDA) Редакция 3";3;"Обязательны с указанием СНИЛС";"25 лет";"Выдается МО";"Да";"Да";"Да";2;"20.04.2023";"01.02.2025";"https://portal.egisz.rosminzdrav.ru/materials/4313";"1.2.643.5.1.13.13.15.68.3";"Нет";"Нет";;"Нет"
65;65;47;"Справка для получения путевки на санаторно-курортное лечение (CDA) Редакция 1";3;"Обязательны с указанием СНИЛС";"25 лет";"Выдается МО";"Да";"Да";"Да";2;"12.04.2021";"01.02.2025";"https://portal.egisz.rosminzdrav.ru/materials/3831";"1.2.643.5.1.13.13.15.8.1";"Нет";"Нет";;"Нет"
78;78;106;"Талон № 2 на получение специальных талонов (именных направлений) на проезд к месту лечения для получения медицинской помощи (CDA) Редакция 1";3;"Обязательны с указанием СНИЛС";"25 лет";"Выдается МО";"Да";"Да";"Да";2;"30.06.2021";"01.02.2025";"https://portal.egisz.rosminzdrav.ru/materials/3905";"1.2.643.5.1.13.13.15.68.1";"Нет";"Нет";;"Нет"
86;86;81;"Направление к месту лечения для получения медицинской помощи (CDA) Редакция 1";3;"Обязательны с указанием СНИЛС";"25 лет";"Выдается МО";"Да";"Да";"Да";2;"30.06.2021";"01.02.2025";"https://portal.egisz.rosminzdrav.ru/materials/3915";"1.2.643.5.1.13.13.15.67.1";"Нет";"Нет";;"Нет"
278;278;48;"Санаторно-курортная карта (CDA) Редакция 3";3;"Обязательны с указанием СНИЛС";"25 лет";"Хранится в МО";"Да";"Да";"Да";2;"10.01.2025";;"https://portal.egisz.rosminzdrav.ru/materials/4783";"1.2.643.5.1.13.13.15.9.3";"Нет";"Нет";;"Нет"
279;279;50;"Санаторно-курортная карта для детей (CDA) Редакция 3";3;"Обязательны с указанием СНИЛС";"25 лет";"Хранится в МО";"Да";"Да";"Да";2;"10.01.2025";;"https://portal.egisz.rosminzdrav.ru/materials/4785";"1.2.643.5.1.13.13.15.10.3";"Нет";"Нет";;"Нет"
280;280;357;"Обратный талон санаторно-курортной карты (CDA) Редакция 3";3;"Обязательны с указанием СНИЛС";"25 лет";"Хранится в МО";"Да";"Да";"Да";2;"10.01.2025";;"https://portal.egisz.rosminzdrav.ru/materials/4787";"1.2.643.5.1.13.13.15.11.3";"Нет";"Нет";;"Нет"
281;281;361;"Обратный талон санаторно-курортной карты для детей (CDA) Редакция 3";3;"Обязательны с указанием СНИЛС";"25 лет";"Хранится в МО";"Да";"Да";"Да";2;"10.01.2025";;"https://portal.egisz.rosminzdrav.ru/materials/4789";"1.2.643.5.1.13.13.15.12.3";"Нет";"Нет";;"Нет"
283;283;109;"Протокол медицинской манипуляции (CDA) Редакция 2";3;"Обязательны с указанием СНИЛС";"25 лет";"Хранится в МО";"Да";"Да";"Да";2;"10.02.2025";;"https://portal.egisz.rosminzdrav.ru/materials/4797";"1.2.643.5.1.13.13.15.23.2";"Нет";"Нет";;"Нет"
277;277;252;"Карта проведения реанимации и интенсивной терапии (CDA) Редакция 1";3;"Обязательны с указанием СНИЛС";"25 лет";"Хранится в МО";"Да";"Да";"Да";2;"01.03.2025";;"https://portal.egisz.rosminzdrav.ru/materials/4815";"1.2.643.5.1.13.13.15.133.1";"Нет";"Нет";;"Нет"
285;285;540;"Протокол цитологического исследования материала, полученного при профилактическом гинекологическом осмотре, скрининге (CDA) Редакция 1";3;"Обязательны с указанием СНИЛС";"25 лет";"Хранится в МО";"Да";"Да";"Да";2;"10.03.2025";;"https://portal.egisz.rosminzdrav.ru/materials/4821";"1.2.643.5.1.13.13.15.136.1";"Нет";"Нет";;"Нет"
271;271;532;"План радиологического/радиотерапевтического лечения (CDA) Редакция 1";3;"Обязательны с указанием СНИЛС";"25 лет";"Хранится в МО";"Да";"Да";"Да";2;"10.03.2025";;"https://portal.egisz.rosminzdrav.ru/materials/4819";"1.2.643.5.1.13.13.15.129.1";"Нет";"Нет";;"Нет"
272;272;533;"Протокол радиологического/радиотерапевтического лечения (CDA) Редакция 1";3;"Обязательны с указанием СНИЛС";"25 лет";"Хранится в МО";"Да";"Да";"Да";2;"10.03.2025";;"https://portal.egisz.rosminzdrav.ru/materials/4823";"1.2.643.5.1.13.13.15.130.1";"Нет";"Нет";;"Нет"
209;209;81;"Направление к месту лечения для получения медицинской помощи (CDA) Редакция 4";3;"Обязательны с указанием СНИЛС";"25 лет";"Выдается МО";"Да";"Да";"Да";2;"01.06.2027";;"https://portal.egisz.rosminzdrav.ru/materials/4503";"1.2.643.5.1.13.13.15.67.4";"Нет";"Нет";;"Нет"
212;212;362;"О наличии оснований для внеочередного медицинского освидетельствования и об аннулировании действующего медицинского заключения об отсутствии медицинских противопоказаний к владению оружием (при его наличии) (CDA) Редакция 2";3;"Обязательны с указанием СНИЛС";"25 лет";"Хранится в МО";"Да";"Да";"Да";2;"19.12.2023";"01.05.2024";"https://portal.egisz.rosminzdrav.ru/materials/4507";"1.2.643.5.1.13.13.15.62.2";"Нет";"Нет";;"Нет"
232;232;368;"Заключение об установлении факта поствакцинального осложнения (CDA) Редакция 2";3;"Обязательны с указанием СНИЛС";"25 лет";"Хранится в МО";"Да";"Да";"Да";2;"01.06.2027";;"https://portal.egisz.rosminzdrav.ru/materials/4559";"1.2.643.5.1.13.13.15.64.2";"Нет";"Нет";;"Нет"
287;287;383;"Предоперационный осмотр врачом-анестезиологом-реаниматологом (CDA) Редакция 1";3;"Не обязательны";"25 лет";"Хранится в МО";"Да";"Да";"Да";2;"10.05.2025";;"https://portal.egisz.rosminzdrav.ru/materials/4807";"1.2.643.5.1.13.13.15.88.1";"Нет";"Нет";;"Нет"
274;274;535;"Протокол противоопухолевой лекарственной терапии (CDA) Редакция 1";3;"Обязательны с указанием СНИЛС";"25 лет";"Хранится в МО";"Да";"Да";"Да";2;"10.05.2025";;"https://portal.egisz.rosminzdrav.ru/materials/4803";"1.2.643.5.1.13.13.15.132.1";"Нет";"Нет";;"Нет"
288;288;390;"Карта проведения анестезиологического пособия (CDA) Редакция 1";3;"Не обязательны";"25 лет";"Хранится в МО";"Да";"Да";"Да";2;"10.05.2025";;"https://portal.egisz.rosminzdrav.ru/materials/4809";"1.2.643.5.1.13.13.15.127.1";"Нет";"Нет";;"Нет"
286;286;539;"Протокол эндоскопического исследования верхних отделов желудочно-кишечного тракта (CDA) Редакция 1";3;"Обязательны с указанием СНИЛС";"25 лет";"Выдается МО";"Да";"Да";"Да";2;"10.05.2025";;"https://portal.egisz.rosminzdrav.ru/materials/4805";"1.2.643.5.1.13.13.15.135.1";"Нет";"Нет";;"Нет"
273;273;534;"План противоопухолевой лекарственной терапии (CDA) Редакция 1";3;"Обязательны с указанием СНИЛС";"25 лет";"Хранится в МО";"Да";"Да";"Да";2;"10.05.2025";;"https://portal.egisz.rosminzdrav.ru/materials/4799";"1.2.643.5.1.13.13.15.131.1";"Нет";"Нет";;"Нет"
268;268;382;"Протокол анестезиологического пособия (CDA) Редакция 1";3;"Обязательны с указанием СНИЛС";"25 лет";"Хранится в МО";"Да";"Да";"Да";2;"10.05.2025";;"https://portal.egisz.rosminzdrav.ru/materials/4801";"1.2.643.5.1.13.13.15.100.1";"Нет";"Нет";;"Нет"
248;248;49;"Медицинская справка о состоянии здоровья ребенка, отъезжающего в организацию отдыха детей и их оздоровления (CDA) Редакция 3";3;"Обязательны с указанием СНИЛС";"25 лет";"Выдается МО";"Да";"Да";"Да";2;"08.07.2024";;"https://portal.egisz.rosminzdrav.ru/materials/4719";"1.2.643.5.1.13.13.15.44.3";"Да";"Нет";;"Нет"
44;44;10;"Выписной эпикриз из родильного дома (CDA) Редакция 2";3;"Обязательны";"25 лет";"Хранится в МО";"Да";"Да";"Да";2;"14.09.2020";"01.08.2024";"https://portal.egisz.rosminzdrav.ru/materials/2925";"1.2.643.5.1.13.13.15.27.2";"Да";"Нет";;"Нет"
228;228;340;"Результаты профилактического медицинского осмотра / диспансеризации (CDA) Редакция 2";3;"Обязательны с указанием СНИЛС";"25 лет";"Хранится в МО";"Да";"Да";"Да";2;"29.02.2024";;"https://portal.egisz.rosminzdrav.ru/materials/4501";"1.2.643.5.1.13.13.15.28.2";"Да";"Нет";;"Нет"
81;81;122;"Справка о временной нетрудоспособности студента, учащегося техникума, профессионально-технического училища, о болезни, карантине и прочих причинах отсутствия ребенка, посещающего школу, детское дошкольное учреждение (CDA) Редакция 2";3;"Обязательны с указанием СНИЛС";"25 лет";"Выдается МО";"Да";"Да";"Да";2;"30.06.2021";"01.07.2025";"https://portal.egisz.rosminzdrav.ru/materials/3909";"1.2.643.5.1.13.13.15.58.2";"Да";"Нет";;"Нет"
85;85;57;"Направление на консультацию и во вспомогательные кабинеты (CDA) Редакция 1";3;"Обязательны с указанием СНИЛС";"25 лет";"Выдается МО";"Да";"Да";"Да";2;"30.06.2021";;"https://portal.egisz.rosminzdrav.ru/materials/3913";"1.2.643.5.1.13.13.15.32.1";"Да";"Нет";;"Нет"
87;87;49;"Медицинская справка о состоянии здоровья ребенка, отъезжающего в организацию отдыха детей и их оздоровления (CDA) Редакция 1";3;"Обязательны с указанием СНИЛС";"25 лет";"Выдается МО";"Да";"Да";"Да";2;"30.06.2021";"01.07.2025";"https://portal.egisz.rosminzdrav.ru/materials/3917";"1.2.643.5.1.13.13.15.44.1";"Да";"Нет";;"Нет"
185;185;57;"Направление на консультацию и во вспомогательные кабинеты (CDA) Редакция 2";3;"Обязательны с указанием СНИЛС";"25 лет";"Хранится в МО";"Да";"Да";"Да";2;"14.08.2023";;"https://portal.egisz.rosminzdrav.ru/materials/4357";"1.2.643.5.1.13.13.15.32.2";"Да";"Нет";;"Нет"
129;129;340;"Результаты профилактического медицинского осмотра / диспансеризации (CDA) Редакция 1";3;"Не обязательны";"25 лет";"Хранится в МО";"Да";"Да";"Да";2;"28.08.2023";"01.07.2025";"https://portal.egisz.rosminzdrav.ru/materials/4415";"1.2.643.5.1.13.13.15.28.1";"Да";"Нет";;"Нет"
175;175;49;"Медицинская справка о состоянии здоровья ребенка, отъезжающего в организацию отдыха детей и их оздоровления (CDA) Редакция 2";3;"Обязательны с указанием СНИЛС";"25 лет";"Выдается МО";"Да";"Да";"Да";2;"14.08.2023";"01.07.2025";"https://portal.egisz.rosminzdrav.ru/materials/4343";"1.2.643.5.1.13.13.15.44.2";"Да";"Нет";;"Нет"
205;205;10;"Выписной эпикриз из родильного дома (CDA) Редакция 4";3;"Не обязательны";"25 лет";"Хранится в МО";"Да";"Да";"Да";2;"01.12.2023";;"https://portal.egisz.rosminzdrav.ru/materials/4485";"1.2.643.5.1.13.13.15.27.4";"Да";"Нет";;"Нет"
89;89;10;"Выписной эпикриз из родильного дома (CDA) Редакция 3";3;"Не обязательны";"25 лет";"Хранится в МО";"Да";"Да";"Да";2;"30.06.2021";;"https://portal.egisz.rosminzdrav.ru/materials/3921";"1.2.643.5.1.13.13.15.27.3";"Да";"Нет";;"Нет"
253;253;122;"Справка о временной нетрудоспособности студента, учащегося техникума, профессионально-технического училища, о болезни, карантине и прочих причинах отсутствия ребенка, посещающего школу, детское дошкольное учреждение (CDA) Редакция 5";3;"Обязательны с указанием СНИЛС";"25 лет";"Выдается МО";"Да";"Да";"Да";2;"24.06.2024";;"https://portal.egisz.rosminzdrav.ru/materials/4703";"1.2.643.5.1.13.13.15.58.5";"Да";"Нет";;"Нет"
92;92;2;"Эпикриз по законченному случаю амбулаторный (CDA) Редакция 4";3;"Обязательны с указанием СНИЛС";"25 лет";"Хранится в МО";"Да";"Да";"Да";2;"30.06.2021";;"https://portal.egisz.rosminzdrav.ru/materials/3927";"1.2.643.5.1.13.13.15.26.4";"Да";"Нет";;"Нет"
147;147;1;"Эпикриз в стационаре выписной (CDA) Редакция 5";3;"Обязательны с указанием СНИЛС";"25 лет";"Хранится в МО";"Да";"Да";"Да";2;"28.08.2023";;"https://portal.egisz.rosminzdrav.ru/materials/4417";"1.2.643.5.1.13.13.15.25.5";"Да";"Нет";;"Нет"
154;154;88;"Справка об отсутствии контактов с инфекционными больными (CDA) Редакция 4";3;"Обязательны с указанием СНИЛС";"25 лет";"Выдается МО";"Да";"Да";"Да";2;"14.08.2023";;"https://portal.egisz.rosminzdrav.ru/materials/4337";"1.2.643.5.1.13.13.15.56.4";"Да";"Нет";;"Нет"
169;169;122;"Справка о временной нетрудоспособности студента, учащегося техникума, профессионально-технического училища, о болезни, карантине и прочих причинах отсутствия ребенка, посещающего школу, детское дошкольное учреждение (CDA) Редакция 4";3;"Обязательны с указанием СНИЛС";"25 лет";"Выдается МО";"Да";"Да";"Да";2;"14.08.2023";;"https://portal.egisz.rosminzdrav.ru/materials/4339";"1.2.643.5.1.13.13.15.58.4";"Да";"Нет";;"Нет"
292;292;346;"Направление на госпитализацию для оказания специализированной медицинской помощи (CDA) Редакция 3";3;"Обязательны с указанием СНИЛС";"25 лет";"Хранится в МО";"Да";"Да";"Да";2;"10.07.2025";;"https://portal.egisz.rosminzdrav.ru/materials/4879";"1.2.643.5.1.13.13.15.34.3";"Нет";"Нет";;"Нет"
93;93;121;"Протокол цитологического исследования (CDA) Редакция 1";3;"Обязательны с указанием СНИЛС";"25 лет";"Хранится в МО";"Да";"Да";"Да";2;"30.06.2021";;"https://portal.egisz.rosminzdrav.ru/materials/3929";"1.2.643.5.1.13.13.15.20.1";"Да";"Нет";;"Нет"
111;111;85;"Протокол консультации в рамках диспансерного наблюдения (CDA) Редакция 4";3;"Обязательны с указанием СНИЛС";"25 лет";"Хранится в МО";"Да";"Да";"Да";2;"01.01.2022";;"https://portal.egisz.rosminzdrav.ru/materials/4023";"1.2.643.5.1.13.13.15.14.4";"Да";"Нет";;"Нет"
176;176;121;"Протокол цитологического исследования (CDA) Редакция 2";3;"Обязательны с указанием СНИЛС";"25 лет";"Хранится в МО";"Да";"Да";"Да";2;"14.08.2023";;"https://portal.egisz.rosminzdrav.ru/materials/4373";"1.2.643.5.1.13.13.15.20.2";"Да";"Нет";;"Нет"
198;198;381;"Первичный осмотр врачом приемного отделения (дежурным врачом или лечащим врачом) (CDA) Редакция 1";3;"Обязательны с указанием СНИЛС";"25 лет";"Хранится в МО";"Да";"Да";"Да";2;"28.09.2023";;"https://portal.egisz.rosminzdrav.ru/materials/4453";"1.2.643.5.1.13.13.15.86.1";"Да";"Нет";;"Нет"
202;202;107;"Направление на лабораторное исследование (CDA) Редакция 1";3;"Обязательны с указанием СНИЛС";"25 лет";"Хранится в МО";"Да";"Да";"Да";2;"28.09.2023";;"https://portal.egisz.rosminzdrav.ru/materials/4461";"1.2.643.5.1.13.13.15.85.1";"Да";"Нет";;"Нет"
284;284;121;"Протокол цитологического исследования (CDA) Редакция 3";3;"Обязательны с указанием СНИЛС";"25 лет";"Хранится в МО";"Да";"Да";"Да";2;"10.02.2025";;"https://portal.egisz.rosminzdrav.ru/materials/4795";"1.2.643.5.1.13.13.15.20.3";"Да";"Нет";;"Нет"
293;293;91;"Медицинская справка в бассейн (CDA) Редакция 4";3;"Обязательны с указанием СНИЛС";"25 лет";"Выдается МО";"Да";"Да";"Да";2;"10.10.2025";;"https://portal.egisz.rosminzdrav.ru/materials/4991";"1.2.643.5.1.13.13.15.53.4";"Нет";"Нет";;"Нет"
294;294;71;"Медицинское заключение об отсутствии противопоказаний к занятию определенными видами спорта (CDA) Редакция 4";3;"Обязательны с указанием СНИЛС";"25 лет";"Выдается МО";"Да";"Да";"Да";2;"10.10.2025";;"https://portal.egisz.rosminzdrav.ru/materials/4993";"1.2.643.5.1.13.13.15.54.4";"Да";"Нет";;"Нет"
99;99;347;"Выписка из протокола врачебной комиссии (CDA) Редакция 1";3;"Обязательны с указанием СНИЛС";"25 лет";"Хранится в МО";"Да";"Да";"Да";2;"04.11.2021";;"https://portal.egisz.rosminzdrav.ru/materials/3993";"1.2.643.5.1.13.13.15.75.1";"Да";"Нет";;"Нет"
115;115;74;"Карта вызова скорой медицинской помощи (CDA) Редакция 2";3;"Не обязательны";"25 лет";"Хранится в МО";"Да";"Да";"Да";2;"03.02.2022";;"https://portal.egisz.rosminzdrav.ru/materials/4043";"1.2.643.5.1.13.13.15.72.2";"Да";"Нет";;"Нет"
158;158;347;"Выписка из протокола решения врачебной комиссии (CDA) Редакция 2";3;"Обязательны с указанием СНИЛС";"25 лет";"Хранится в МО";"Да";"Да";"Да";2;"28.08.2023";;"https://portal.egisz.rosminzdrav.ru/materials/4307";"1.2.643.5.1.13.13.15.75.2";"Да";"Нет";;"Нет"
191;191;341;"Осмотр лечащим врачом, врачом-специалистом, заведующим отделением, лечащим врачом совместно с врачом-специалистом, лечащим врачом совместно с заведующим отделением (CDA) Редакция 1";3;"Обязательны с указанием СНИЛС";"25 лет";"Хранится в МО";"Да";"Да";"Да";2;"14.08.2023";;"https://portal.egisz.rosminzdrav.ru/materials/4365";"1.2.643.5.1.13.13.15.78.1";"Да";"Нет";;"Нет"
306;306;51;"Медицинское заключение по результатам предварительного (периодического) медицинского осмотра (обследования) (CDA) Редакция 3";3;"Обязательны с указанием СНИЛС";"25 лет";"Выдается МО";"Да";"Да";"Да";2;"10.11.2025";;"https://portal.egisz.rosminzdrav.ru/materials/5011";"1.2.643.5.1.13.13.15.47.3";"Да";"Нет";;"Нет"
296;296;462;"Заключение о состоянии здоровья ребенка-сироты, ребенка, оставшегося без попечения родителей, помещаемого под надзор в организацию для детей-сирот и детей, оставшихся без попечения родителей (CDA) Редакция 1";3;"Обязательны";"25 лет";"Выдается МО";"Да";"Да";"Да";2;"10.11.2025";;"https://portal.egisz.rosminzdrav.ru/materials/5009";"1.2.643.5.1.13.13.15.142.1";"Нет";"Нет";;"Нет"
305;305;475;"Медицинское заключение о наличии (об отсутствии) у трактористов, машинистов и водителей самоходных машин (кандидатов в трактористы, машинисты и водители самоходных машин) медицинских противопоказаний, медицинских показаний или медицинских ограничений к управлению самоходными машинами (CDA) Редакция 1";3;"Обязательны с указанием СНИЛС";"25 лет";"Выдается МО";"Да";"Да";"Да";2;"10.11.2025";;"https://portal.egisz.rosminzdrav.ru/materials/5010";"1.2.643.5.1.13.13.15.146.1";"Нет";"Нет";;"Нет"
307;307;349;"Протокол консилиума врачей (CDA) Редакция 1";3;"Обязательны с указанием СНИЛС";"25 лет";"Хранится в МО";"Да";"Да";"Да";2;"17.11.2025";;"https://portal.egisz.rosminzdrav.ru/materials/5012";"1.2.643.5.1.13.13.15.148.1";"Нет";"Нет";;"Нет"
323;323;542;"Протокол ультразвукового исследования предстательной железы (CDA) Редакция 1";3;"Обязательны с указанием СНИЛС";"25 лет";"Хранится в МО";"Да";"Да";"Да";2;"10.04.2026";;;"1.2.643.5.1.13.13.15.138.1";"Нет";"Нет";;"Нет"
